{
  "schema_version":"1.0",
  "brand_workspace_id":"brand-workspace:antigua-2026",
  "tenant_id":"tenant:bernydotjar",
  "campaign_id":"campaign:antigua-guatemala-exploratory",
  "workspace_id":"workspace:antigua-2026",
  "candidate_id":"candidate:antigua-owner",
  "status":"SETUP_REQUIRED",
  "identity":{"id":"brand-claim:antigua-identity","status":"UNKNOWN","classification":"UNKNOWN","claim":"Candidate identity profile is not yet documented in repository evidence.","evidence_refs":[],"created_at":null,"updated_at":"2026-07-18","owner":"Candidate Brand and Reputation","source_or_provenance":"C2-PROD-001 repository audit","tenant_id":"tenant:bernydotjar","campaign_id":"campaign:antigua-guatemala-exploratory","workspace_id":"workspace:antigua-2026","candidate_id":"candidate:antigua-owner"},
  "biography":{"id":"brand-claim:antigua-biography","status":"UNKNOWN","classification":"UNKNOWN","claim":"Verified political biography has not been assembled.","evidence_refs":[],"created_at":null,"updated_at":"2026-07-18","owner":"Candidate Brand and Reputation","source_or_provenance":"C2-PROD-001 repository audit","tenant_id":"tenant:bernydotjar","campaign_id":"campaign:antigua-guatemala-exploratory","workspace_id":"workspace:antigua-2026","candidate_id":"candidate:antigua-owner"},
  "purpose":{"id":"brand-claim:antigua-purpose","status":"UNDER_REVIEW","classification":"HYPOTHESIS","claim":"Candidate purpose requires a governed identity interview and documentary verification.","evidence_refs":[],"created_at":null,"updated_at":"2026-07-18","owner":"Candidate Brand and Reputation","source_or_provenance":"C2-PROD-001 setup hypothesis","tenant_id":"tenant:bernydotjar","campaign_id":"campaign:antigua-guatemala-exploratory","workspace_id":"workspace:antigua-2026","candidate_id":"candidate:antigua-owner"},
  "values":[],"attributes":[],"proof_points":[],"perception_gaps":[],"behavioral_consistency_reviews":[],
  "reputation_risks":[{"id":"reputation-risk:antigua-evidence-gap","status":"OPEN","severity":"HIGH","description":"Public brand claims would be unsupported because identity, biography, attributes and proof points are not yet evidenced.","decision_required":true,"evidence_refs":[],"created_at":"2026-07-18","updated_at":"2026-07-18","owner":"Campaign Chief","source_or_provenance":"C2-PROD-001 repository audit","tenant_id":"tenant:bernydotjar","campaign_id":"campaign:antigua-guatemala-exploratory","workspace_id":"workspace:antigua-2026","candidate_id":"candidate:antigua-owner"}],
  "approvals":[],
  "metadata":{"fixture_type":"OPERATOR_WORKSPACE","next_research_action":"Conduct a governed Candidate Identity Interview and collect evidence before defining attributes or public positioning.","notes":"No candidate attribute is inferred from self-description or external memory."}
}
